number,value,datetime_start,datetime_complete,duration,params_batch_size,params_channel_masking_rate,params_lambda_smooth,params_lr,params_num_decoders,params_num_f_maps,params_num_layers,params_r1,params_r2,params_time_alignment,params_weight_decay,state
0,,2026-06-21 19:39:23.493497,2026-06-21 19:39:29.957662,0 days 00:00:06.464165,8,0.3832290311184182,0.2497327922401265,0.00010838581269344756,1,64,10,2,2,upsample_preds,0.00757947995334801,FAIL
1,0.724703311920166,2026-06-21 19:40:34.237324,2026-06-21 20:12:48.923268,0 days 00:32:14.685944,8,0.3832290311184182,0.2497327922401265,0.00010838581269344756,1,64,10,2,2,upsample_preds,0.00757947995334801,COMPLETE
2,0.39768049120903015,2026-06-21 20:12:48.951036,2026-06-21 20:18:51.487125,0 days 00:06:02.536089,32,0.3056937753654446,0.1822634555704315,0.0010150667045928574,2,128,6,4,2,downsample_labels,1.5339162591163623e-06,COMPLETE
3,0.713473916053772,2026-06-21 20:18:51.505449,2026-06-21 20:33:20.472923,0 days 00:14:28.967474,16,0.36500891374159283,0.16401308380298388,0.00033852267834519784,1,128,9,2,2,downsample_labels,0.00012030178871154674,COMPLETE
4,0.7396241426467896,2026-06-21 20:33:20.492442,2026-06-21 20:42:51.141512,0 days 00:09:30.649070,32,0.2427013306774357,0.04227726749242879,0.00030012301808980484,1,64,7,4,4,downsample_labels,0.00014817820606039095,COMPLETE
5,0.25359293818473816,2026-06-21 20:42:51.161456,2026-06-21 20:53:35.335901,0 days 00:10:44.174445,16,0.3493192507310232,0.09329469651469866,0.0003649100451857361,4,64,11,4,4,downsample_labels,1.7956984225677624e-06,COMPLETE
6,0.7379262149333954,2026-06-21 20:53:35.356492,2026-06-21 21:31:11.023255,0 days 00:37:35.666763,16,0.1431565707973218,0.094306794322898,0.00011308297976636003,4,128,9,4,2,upsample_preds,0.00035127047262708476,COMPLETE
7,0.25359293818473816,2026-06-21 21:31:11.044297,2026-06-21 21:45:35.241652,0 days 00:14:24.197355,8,0.17462802355441434,0.24223204654921876,0.0032842103509117325,4,128,7,2,2,upsample_preds,0.00014367095138664247,COMPLETE
8,0.6095224618911743,2026-06-21 21:45:35.261834,2026-06-21 22:22:02.827915,0 days 00:36:27.566081,8,0.2292811728083021,0.1090888807137882,0.0007610438922351135,2,64,9,2,4,downsample_labels,0.0006487477066058681,COMPLETE
9,0.3986906420905143,2026-06-21 22:22:02.847808,2026-06-21 22:30:53.403367,0 days 00:08:50.555559,8,0.2957811041110252,0.20164066422176355,0.004727053921131424,1,128,9,4,2,upsample_preds,9.294394155644998e-06,COMPLETE
10,0.711050808429718,2026-06-21 22:30:53.422863,2026-06-21 22:52:16.688153,0 days 00:21:23.265290,16,0.10663513157114246,0.19355183712283494,0.0007413627235366399,2,32,11,2,4,downsample_labels,8.053471030316104e-06,COMPLETE
11,0.5887200236320496,2026-06-21 22:52:16.708869,2026-06-21 22:58:05.712890,0 days 00:05:49.004021,32,0.4630659181130071,0.010624398975112616,0.0002716381563904919,3,32,7,4,4,downsample_labels,0.002885702455817911,PRUNED
12,0.7435922920703888,2026-06-21 22:58:05.731413,2026-06-21 23:10:00.088584,0 days 00:11:54.357171,32,0.1872448336277705,0.024260342383004053,0.00010179341908802777,3,64,8,4,4,upsample_preds,0.0005026037920196701,COMPLETE
13,0.7432022392749786,2026-06-21 23:10:00.108342,2026-06-21 23:22:47.257824,0 days 00:12:47.149482,32,0.23711971530652654,0.0007138383016753978,0.00019051933429559194,3,64,7,4,4,upsample_preds,3.104868916478337e-05,COMPLETE
14,0.6790173351764679,2026-06-21 23:22:47.277685,2026-06-21 23:29:08.573292,0 days 00:06:21.295607,32,0.2208716525243558,0.005937878084687889,0.00018015488144957058,3,64,8,4,4,upsample_preds,2.43476321705731e-05,PRUNED
15,0.7445861399173737,2026-06-21 23:29:08.591235,2026-06-21 23:40:54.993503,0 days 00:11:46.402268,32,0.1850524623951855,0.04247527249570536,0.0001654592491436404,3,64,6,4,4,upsample_preds,0.0011607812092398922,COMPLETE
16,0.25359293818473816,2026-06-21 23:40:55.015734,2026-06-21 23:43:39.598320,0 days 00:02:44.582586,32,0.17457935590701595,0.052799546126449236,0.0015903847633238926,3,64,6,4,4,upsample_preds,0.0012685264999107398,COMPLETE
17,0.6824581623077393,2026-06-21 23:43:39.617370,2026-06-21 23:49:50.959725,0 days 00:06:11.342355,32,0.11451352700692245,0.05499160674422275,0.00010402636507710082,3,64,8,4,4,upsample_preds,0.0029808668197404318,PRUNED
18,0.6831276416778564,2026-06-21 23:49:50.979394,2026-06-22 00:02:00.291247,0 days 00:12:09.311853,32,0.17530896906320864,0.12731977834582386,0.00017475681527842114,2,32,12,4,4,upsample_preds,0.0005063372770920704,PRUNED
19,0.5870030224323273,2026-06-22 00:02:00.310340,2026-06-22 00:07:48.981483,0 days 00:05:48.671143,32,0.26688300791166797,0.28254467559194796,0.0004860384085106945,4,64,6,4,4,upsample_preds,0.0017749268922401364,PRUNED
20,0.6466957926750183,2026-06-22 00:07:49.000578,2026-06-22 00:13:57.609186,0 days 00:06:08.608608,32,0.479851568565839,0.07559919085480513,0.0001744733592322853,3,64,8,4,4,upsample_preds,0.006974425952565119,PRUNED
21,0.7397546172142029,2026-06-22 00:13:57.627450,2026-06-22 00:20:08.082594,0 days 00:06:10.455144,32,0.1926153171127986,0.03488476299455609,0.0004952926047290725,2,32,6,4,4,upsample_preds,0.00028378612563366364,COMPLETE
22,0.7567752599716187,2026-06-22 00:20:08.103770,2026-06-22 00:32:58.463984,0 days 00:12:50.360214,32,0.20632429079356646,0.015576358312520043,0.0002038185867361128,3,64,7,4,4,upsample_preds,5.257723195774366e-05,COMPLETE
23,0.6844302117824554,2026-06-22 00:32:58.483080,2026-06-22 00:39:11.605603,0 days 00:06:13.122523,32,0.14033938729804057,0.027606076679621713,0.00014282365542331145,3,64,8,4,4,upsample_preds,4.5106649320387854e-05,PRUNED
24,0.6843813955783844,2026-06-22 00:39:11.621481,2026-06-22 00:44:52.929646,0 days 00:05:41.308165,32,0.19429329213639057,0.06751345168008165,0.0002411758977856653,3,64,7,4,4,upsample_preds,0.0009432931152097467,PRUNED
25,0.6763271391391754,2026-06-22 00:44:52.948352,2026-06-22 00:52:14.951522,0 days 00:07:22.003170,32,0.2847036445840509,0.1392326356955362,0.0001427428299448284,4,64,8,4,4,upsample_preds,0.00027414092941971185,PRUNED
26,0.724687933921814,2026-06-22 00:52:14.965005,2026-06-22 01:00:50.611746,0 days 00:08:35.646741,32,0.14590512657150473,0.07807046407266327,0.0002280174651915541,3,64,6,4,4,upsample_preds,5.948521737959489e-05,PRUNED
27,0.7410330474376678,2026-06-22 01:00:50.631555,2026-06-22 01:08:44.429959,0 days 00:07:53.798404,32,0.21190276968953947,0.021820266728575247,0.0004408695521154781,2,64,7,2,4,upsample_preds,1.1983161343563644e-05,COMPLETE
28,0.659385621547699,2026-06-22 01:08:44.449750,2026-06-22 01:15:23.919707,0 days 00:06:39.469957,32,0.25346052729312196,0.11479780289316852,0.00012504302260153564,3,64,10,4,4,upsample_preds,0.0024873378056315936,COMPLETE
29,0.25359293818473816,2026-06-22 01:15:23.940589,2026-06-22 01:29:50.436560,0 days 00:14:26.495971,16,0.3162677862607134,0.03450592158350996,0.0016871621165935572,4,32,7,4,4,upsample_preds,7.322136703039693e-05,PRUNED
30,0.6843932569026947,2026-06-22 01:29:50.454591,2026-06-22 02:01:18.546809,0 days 00:31:28.092218,8,0.42511213204333076,0.0656633582193892,0.0001002140208586791,3,64,10,2,2,upsample_preds,0.007643179028325484,PRUNED
31,0.7484583258628845,2026-06-22 02:01:18.569859,2026-06-22 02:38:34.934440,0 days 00:37:16.364581,8,0.33360167099798527,0.01955030758313396,0.00014506517920250404,2,64,6,4,4,upsample_preds,0.0007640836668355424,COMPLETE
32,0.7296123206615448,2026-06-22 02:38:34.956886,2026-06-22 03:01:40.625975,0 days 00:23:05.669089,8,0.40027190624629405,0.022615677207446106,0.00014372083178987877,2,64,6,4,4,upsample_preds,0.0010951207362057901,COMPLETE
33,0.727288007736206,2026-06-22 03:01:40.645796,2026-06-22 03:26:40.759076,0 days 00:25:00.113280,8,0.332965131492984,0.04816637939210125,0.00021208959948648223,2,64,6,4,4,upsample_preds,0.0006264912312378189,COMPLETE
34,0.7164429426193237,2026-06-22 03:26:40.781767,2026-06-22 03:47:13.996140,0 days 00:20:33.214373,8,0.3882652229206362,0.011994470150918262,0.00014351203907772417,2,64,6,4,4,upsample_preds,0.00020080145239152825,PRUNED
35,0.7182717025279999,2026-06-22 03:47:14.015158,2026-06-22 04:08:17.992349,0 days 00:21:03.977191,8,0.272005006291418,0.0007701190917959386,0.00035850569150055767,1,64,7,4,2,upsample_preds,0.003906392963612406,PRUNED
36,0.7212918996810913,2026-06-22 04:08:18.013371,2026-06-22 04:21:27.422357,0 days 00:13:09.408986,32,0.3645141279137052,0.16652115263105946,0.0002885060110038191,3,128,8,4,4,downsample_labels,9.355309800953536e-05,PRUNED
37,0.7276851236820221,2026-06-22 04:21:27.442815,2026-06-22 04:39:12.597738,0 days 00:17:45.154923,16,0.3161019219015833,0.09215813712565955,0.00013315098305844268,3,64,7,4,4,upsample_preds,0.0004470067548227945,COMPLETE
38,0.7435505390167236,2026-06-22 04:39:12.619620,2026-06-22 05:08:32.326944,0 days 00:29:19.707324,8,0.15317927411123775,0.044351335213241715,0.0001688161070859365,2,128,6,2,2,upsample_preds,3.2093933789987946e-06,COMPLETE
39,0.7476829290390015,2026-06-22 05:08:32.347844,2026-06-22 05:23:28.014209,0 days 00:14:55.666365,32,0.12793020688208606,0.022413347375294126,0.00010145591874524111,4,64,7,4,4,downsample_labels,0.00016876857917530886,COMPLETE
40,0.25359293818473816,2026-06-22 05:23:28.033132,2026-06-22 05:29:44.410018,0 days 00:06:16.376886,16,0.1238041723106287,0.22300028609110717,0.0010994755061579336,4,64,6,4,2,downsample_labels,0.00015732193239289692,COMPLETE
41,0.7447139918804169,2026-06-22 05:29:44.433720,2026-06-22 06:21:13.402479,0 days 00:51:28.968759,8,0.1578587581716505,0.060071499756020795,0.0002451120572743041,4,128,7,2,4,downsample_labels,2.2773219946934398e-05,COMPLETE
42,0.7121542096138,2026-06-22 06:21:13.422561,2026-06-22 06:59:05.074585,0 days 00:37:51.652024,8,0.13315058026104737,0.05760991239874176,0.00023172897176101533,4,128,7,2,4,downsample_labels,1.8971765470161146e-05,PRUNED
43,0.6526810824871063,2026-06-22 06:59:05.094748,2026-06-22 07:25:10.100553,0 days 00:26:05.005805,8,0.10044973860108516,0.08518426261847745,0.00030621484956760303,4,128,7,2,4,downsample_labels,4.160502078836492e-05,PRUNED
44,0.7182537317276001,2026-06-22 07:25:10.121329,2026-06-22 07:58:27.067586,0 days 00:33:16.946257,8,0.1671405293956792,0.03810271159849589,0.00012137445942723811,4,128,6,2,4,downsample_labels,0.00011690591443893415,PRUNED
45,0.663547933101654,2026-06-22 07:58:27.087355,2026-06-22 08:25:15.634564,0 days 00:26:48.547209,8,0.20784738207615966,0.017352375267398468,0.0002121871980582159,4,128,7,2,4,downsample_labels,5.228479824332207e-06,PRUNED
46,0.5513783693313599,2026-06-22 08:25:15.654733,2026-06-22 08:39:29.954373,0 days 00:14:14.299640,8,0.16054219784967727,0.10001222797919865,0.0005886400163194284,1,128,9,2,4,downsample_labels,1.4338874113437808e-05,PRUNED
47,0.6197223663330078,2026-06-22 08:39:29.974055,2026-06-22 08:46:13.404612,0 days 00:06:43.430557,32,0.3450287519436588,0.06608788649859554,0.0002544495382701367,4,64,7,2,4,downsample_labels,1.1354877896376894e-06,PRUNED
48,0.7189026176929474,2026-06-22 08:46:13.423559,2026-06-22 09:14:45.230654,0 days 00:28:31.807095,8,0.2486181104281691,0.040415239715272055,0.00015642821990004637,4,32,6,4,2,downsample_labels,2.9635580167936733e-05,PRUNED
49,0.7171272337436676,2026-06-22 09:14:45.252381,2026-06-22 09:25:58.890392,0 days 00:11:13.638011,16,0.12696072064912273,0.016002655664600043,0.00039069534922388737,1,128,7,4,4,downsample_labels,0.0008004647478642576,PRUNED
50,0.6973778903484344,2026-06-22 09:25:58.913823,2026-06-22 09:32:28.770661,0 days 00:06:29.856838,32,0.22431593351887402,0.031021239525400493,0.00011852763166954924,4,64,6,4,4,downsample_labels,0.00018696994136044873,PRUNED
51,0.7119625508785248,2026-06-22 09:32:28.788663,2026-06-22 09:39:58.187759,0 days 00:07:29.399096,32,0.2005548310962457,0.05363724240066537,0.00031652651768311385,2,64,8,2,4,downsample_labels,0.0016330586242380878,PRUNED
52,0.7384396493434906,2026-06-22 09:39:58.204753,2026-06-22 09:52:50.488701,0 days 00:12:52.283948,32,0.18245210337225093,0.00029713070407904815,0.00010937477784820893,3,64,8,4,4,upsample_preds,0.0003751477504253406,COMPLETE
53,0.6714378893375397,2026-06-22 09:52:50.509384,2026-06-22 09:58:33.173206,0 days 00:05:42.663822,32,0.16164466176584188,0.01911477699465177,0.00018436476040117157,3,64,7,4,4,upsample_preds,0.00024738430158572765,PRUNED
54,0.6937661170959473,2026-06-22 09:58:33.189158,2026-06-22 10:04:48.648453,0 days 00:06:15.459295,32,0.18256575125889882,0.025867175072212138,0.00010191186930319595,3,64,8,4,4,upsample_preds,0.000547699539654229,PRUNED
55,0.681386411190033,2026-06-22 10:04:48.667365,2026-06-22 10:11:27.340093,0 days 00:06:38.672728,32,0.11963313913979179,0.009510405266627378,0.00020294438278176092,3,64,9,4,4,downsample_labels,8.513481149412351e-05,PRUNED
56,0.7378035187721252,2026-06-22 10:11:27.359228,2026-06-22 10:21:18.257208,0 days 00:09:50.897980,32,0.14757586039182208,0.2980688605980709,0.00015893358468940038,3,64,7,4,4,upsample_preds,5.3558085696093896e-05,COMPLETE
57,0.25359293818473816,2026-06-22 10:21:18.278697,2026-06-22 10:24:35.851612,0 days 00:03:17.572915,32,0.2371253561558084,0.04411362082727256,0.00011945760818077884,3,32,8,4,4,upsample_preds,0.0015790575618962513,COMPLETE
58,0.7401244044303894,2026-06-22 10:24:35.871798,2026-06-22 10:33:27.935735,0 days 00:08:52.063937,32,0.18617390113645504,0.060244208694102894,0.00016198951654141557,2,64,6,4,4,downsample_labels,0.0007338373746020323,COMPLETE
59,0.657279372215271,2026-06-22 10:33:27.956567,2026-06-22 10:55:20.184816,0 days 00:21:52.228249,32,0.2217159790733126,0.07430972749463449,0.00019321510427492444,4,64,12,4,4,upsample_preds,0.0003852112741634578,PRUNED
60,0.7400577366352081,2026-06-22 10:55:20.204940,2026-06-22 11:41:30.863331,0 days 00:46:10.658391,8,0.29803959726447776,0.02997397117558776,0.00013004659453315362,3,64,7,4,4,upsample_preds,0.0024610257103975654,COMPLETE
