number,value,datetime_start,datetime_complete,duration,params_batch_size,params_dropout,params_hidden_size,params_lambda_smooth,params_lr,params_num_layers,params_time_alignment,params_weight_decay,user_attrs_dropout_effective,state
92,0.7575957477092743,2026-06-22 23:59:07.675793,2026-06-23 00:01:43.190366,0 days 00:02:35.514573,32,0.4462366463266214,64,0.23126718981545633,0.00017395435877360347,2,downsample_labels,1.0113944242712683e-06,0.4462366463266214,COMPLETE
93,0.652124434709549,2026-06-23 00:01:43.213011,2026-06-23 00:02:42.221812,0 days 00:00:59.008801,32,0.4260056677570421,64,0.23151629891146366,0.00014184337799558278,2,downsample_labels,1.1099291454674626e-06,0.4260056677570421,PRUNED
94,0.6580333411693573,2026-06-23 00:02:42.237501,2026-06-23 00:03:34.702057,0 days 00:00:52.464556,32,0.44185443170072536,64,0.24364629814960634,0.00018030765186015187,2,downsample_labels,1.0012989784113892e-06,0.44185443170072536,PRUNED
95,0.7556876838207245,2026-06-23 00:03:34.719694,2026-06-23 00:05:46.375239,0 days 00:02:11.655545,32,0.48794736791022364,64,0.22535346028069192,0.00015762094141831773,2,downsample_labels,1.647158023018085e-06,0.48794736791022364,COMPLETE
96,0.6387148499488831,2026-06-23 00:05:46.395342,2026-06-23 00:06:37.769304,0 days 00:00:51.373962,32,0.4810200695696108,64,0.22614820281563466,0.00016270697385608357,2,downsample_labels,4.591724943498551e-06,0.4810200695696108,PRUNED
97,0.7036826610565186,2026-06-23 00:06:37.786500,2026-06-23 00:08:12.416522,0 days 00:01:34.630022,32,0.3927347276216991,64,0.2016503817606452,0.00012232470567635114,2,downsample_labels,7.717063151959362e-06,0.3927347276216991,PRUNED
98,0.636560320854187,2026-06-23 00:08:12.434568,2026-06-23 00:10:12.256212,0 days 00:01:59.821644,8,0.48781461765138756,64,0.23591586852981855,0.0002211960715864761,2,downsample_labels,1.2479724908967552e-05,0.48781461765138756,PRUNED
99,0.6553756892681122,2026-06-23 00:10:12.276115,2026-06-23 00:11:02.136442,0 days 00:00:49.860327,32,0.4653656652176406,64,0.21227464465192097,0.00014534933326599235,2,downsample_labels,2.357855557031879e-06,0.4653656652176406,PRUNED
100,0.555031955242157,2026-06-23 00:11:02.152891,2026-06-23 00:13:09.372050,0 days 00:02:07.219159,32,0.4460435979986799,512,0.25593355518827865,0.00019231979270215225,2,downsample_labels,3.3702805157635577e-06,0.4460435979986799,COMPLETE
101,0.6490009129047394,2026-06-23 00:13:09.392467,2026-06-23 00:13:52.935543,0 days 00:00:43.543076,32,0.4026486741145074,64,0.2754926232265944,0.0002473293162192941,2,downsample_labels,1.6406673392649204e-06,0.4026486741145074,COMPLETE
102,0.6316590905189514,2026-06-23 00:13:52.957504,2026-06-23 00:14:32.519981,0 days 00:00:39.562477,32,0.42981281446607233,64,0.28548651753362303,0.0001764681964988665,2,downsample_labels,1.8673095585111228e-06,0.42981281446607233,COMPLETE
103,0.6539580225944519,2026-06-23 00:14:32.541183,2026-06-23 00:15:21.999386,0 days 00:00:49.458203,32,0.45574272194917886,64,0.22312668617581874,0.0003075782447396154,2,downsample_labels,1.412571686749873e-06,0.45574272194917886,PRUNED
104,0.7379905581474304,2026-06-23 00:15:22.015354,2026-06-23 00:17:07.799775,0 days 00:01:45.784421,32,0.36888914793478056,64,0.2648207660725408,0.00034180296609115314,2,downsample_labels,1.5283347687411735e-05,0.36888914793478056,COMPLETE
105,0.6662688851356506,2026-06-23 00:17:07.820105,2026-06-23 00:18:11.022920,0 days 00:01:03.202815,32,0.49472463888790497,64,0.24866692844065086,0.00022380322303530194,2,upsample_preds,1.2587425998249806e-06,0.49472463888790497,PRUNED
106,0.7308821678161621,2026-06-23 00:18:11.040173,2026-06-23 00:20:08.664341,0 days 00:01:57.624168,32,0.4772661425194067,64,0.26873930632316656,0.00027819174754761865,2,downsample_labels,8.326200516524057e-05,0.4772661425194067,COMPLETE
107,0.6517294645309448,2026-06-23 00:20:08.685732,2026-06-23 00:21:23.502078,0 days 00:01:14.816346,32,0.26471788684412906,256,0.24313023460308952,0.00012572051165692726,2,downsample_labels,3.43717796081202e-06,0.26471788684412906,COMPLETE
108,0.64183509349823,2026-06-23 00:21:23.523463,2026-06-23 00:22:13.239862,0 days 00:00:49.716399,32,0.3263295421991264,64,0.29572672261159905,0.00019883207164977742,2,downsample_labels,6.795392656673354e-05,0.3263295421991264,PRUNED
109,0.7340680658817291,2026-06-23 00:22:13.256319,2026-06-23 00:24:10.022962,0 days 00:01:56.766643,32,0.2837848840623813,64,0.28354772053379607,0.00025469162745733514,2,downsample_labels,2.919687085459846e-05,0.2837848840623813,COMPLETE
110,0.5449921786785126,2026-06-23 00:24:10.044182,2026-06-23 00:25:20.491353,0 days 00:01:10.447171,16,0.3486992682221344,64,0.25873971320471845,0.003237081293881778,2,downsample_labels,5.5876745909964286e-05,0.3486992682221344,PRUNED
111,0.754135936498642,2026-06-23 00:25:20.508517,2026-06-23 00:28:10.806057,0 days 00:02:50.297540,32,0.14415513448328487,64,0.2355272210424059,0.00029531153962923835,2,downsample_labels,0.00015061867784560507,0.14415513448328487,COMPLETE
112,0.6164089143276215,2026-06-23 00:28:10.829210,2026-06-23 00:29:03.401777,0 days 00:00:52.572567,32,0.14263087766961793,64,0.23779309618977293,0.000297875630611356,2,downsample_labels,0.0001569088367061632,0.14263087766961793,PRUNED
113,0.7547087669372559,2026-06-23 00:29:03.418107,2026-06-23 00:31:57.523941,0 days 00:02:54.105834,32,0.19332376375072327,64,0.22948050661878847,0.00023138392318557688,2,downsample_labels,0.0003147050732408451,0.19332376375072327,COMPLETE
114,0.6273516416549683,2026-06-23 00:31:57.545250,2026-06-23 00:32:50.200128,0 days 00:00:52.654878,32,0.1272838320815034,64,0.22273416034599117,0.0002339256003108303,2,downsample_labels,0.0003016963858116419,0.1272838320815034,PRUNED
115,0.7495471239089966,2026-06-23 00:32:50.217733,2026-06-23 00:35:15.312676,0 days 00:02:25.094943,32,0.08552980226218129,64,0.2135344690031179,0.00015574801062390688,2,downsample_labels,0.00018592735378966275,0.08552980226218129,COMPLETE
116,0.6537394523620605,2026-06-23 00:35:15.333857,2026-06-23 00:36:05.134854,0 days 00:00:49.800997,32,0.08180645754343012,64,0.23234917017724624,0.0001585186159020359,2,downsample_labels,0.00023622267601769792,0.08180645754343012,PRUNED
117,0.6166253387928009,2026-06-23 00:36:05.151059,2026-06-23 00:36:54.388056,0 days 00:00:49.236997,32,0.11577317963280705,64,0.21325763511534068,0.00012828269201679932,2,downsample_labels,0.0006002087047367614,0.11577317963280705,PRUNED
118,0.6651250123977661,2026-06-23 00:36:54.404175,2026-06-23 00:38:46.495709,0 days 00:01:52.091534,8,0.08929183981697193,64,0.2278298232689415,0.00015043624817168318,2,downsample_labels,0.0002030328856166229,0.08929183981697193,PRUNED
119,0.7275221347808838,2026-06-23 00:38:46.513417,2026-06-23 00:40:23.011582,0 days 00:01:36.498165,32,0.0658716393751154,64,0.20548287009201124,0.0002092277268654993,2,downsample_labels,0.00012359910063593874,0.0658716393751154,COMPLETE
