number,value,datetime_start,datetime_complete,duration,params_batch_size,params_dropout,params_hidden_size,params_lambda_smooth,params_lr,params_num_layers,params_time_alignment,params_weight_decay,user_attrs_dropout_effective,state
0,0.7407092154026031,2026-06-21 19:40:09.526519,2026-06-21 19:44:38.837139,0 days 00:04:29.310620,32,0.07799726016810132,64,0.18033450352296262,0.00012551115172973836,2,downsample_labels,0.0029154431891537554,0.07799726016810132,COMPLETE
1,0.7453301250934601,2026-06-21 19:44:38.875494,2026-06-21 19:53:48.939560,0 days 00:09:10.064066,32,,256,0.04184815819561255,0.0003124565071260876,1,downsample_labels,0.0002801635158716264,0.0,COMPLETE
2,0.5718899667263031,2026-06-21 19:53:48.963632,2026-06-21 19:56:22.816093,0 days 00:02:33.852461,32,0.03252579649263976,256,0.24251920443493832,0.004093813608598782,2,downsample_labels,0.007286653737491046,0.03252579649263976,COMPLETE
3,0.7215625047683716,2026-06-21 19:56:22.838499,2026-06-21 20:05:45.041287,0 days 00:09:22.202788,8,0.15585553804470548,128,0.05545633665765811,0.0007648565112369955,2,downsample_labels,0.00015375920235481777,0.15585553804470548,COMPLETE
4,0.2966139353811741,2026-06-21 20:05:45.062778,2026-06-21 20:18:02.791428,0 days 00:12:17.728650,16,0.194338644844741,512,0.10702599800807679,0.00028907721743726757,3,downsample_labels,0.0020651425578959264,0.194338644844741,COMPLETE
5,0.28712591528892517,2026-06-21 20:18:02.811269,2026-06-21 20:23:52.882818,0 days 00:05:50.071549,32,0.35342867192380856,512,0.02221339552022711,0.001732053535845956,3,downsample_labels,0.0012164139351417069,0.35342867192380856,COMPLETE
6,0.6133230626583099,2026-06-21 20:23:52.902990,2026-06-21 20:28:43.390236,0 days 00:04:50.487246,16,,256,0.035878273781490506,0.00321623546920742,1,downsample_labels,7.742116473996259e-05,0.0,COMPLETE
7,0.743274986743927,2026-06-21 20:28:43.410966,2026-06-21 20:33:18.392607,0 days 00:04:34.981641,32,0.3182052056318902,64,0.2722699421778279,0.00034204353211648276,2,downsample_labels,0.00010821382910613992,0.3182052056318902,COMPLETE
8,0.7066523730754852,2026-06-21 20:33:18.413604,2026-06-21 20:43:38.297561,0 days 00:10:19.883957,8,,128,0.05597101766581075,0.00302402517740569,1,downsample_labels,0.0016394127471631608,0.0,COMPLETE
9,0.6216918230056763,2026-06-21 20:43:38.320547,2026-06-21 20:45:43.909886,0 days 00:02:05.589339,32,,512,0.1252233009446337,0.0001027570105825669,1,downsample_labels,0.00011040511903162256,0.0,COMPLETE
10,0.6140123307704926,2026-06-21 20:45:43.928728,2026-06-21 20:49:41.974551,0 days 00:03:58.045823,16,,256,0.1920265507402669,0.0006998387382996549,1,upsample_preds,1.1799062523159305e-06,0.0,COMPLETE
11,0.6161195337772369,2026-06-21 20:49:41.994263,2026-06-21 20:51:06.808322,0 days 00:01:24.814059,32,0.4961813327301685,64,0.2858052257678622,0.0003036016673469324,2,upsample_preds,1.0060086171748069e-05,0.4961813327301685,PRUNED
12,0.6591050624847412,2026-06-21 20:51:06.821155,2026-06-21 20:53:52.418323,0 days 00:02:45.597168,32,0.35255226809906276,64,0.23744079967498566,0.0003056830276347288,3,upsample_preds,0.0003832002315345681,0.35255226809906276,PRUNED
13,0.6275103986263275,2026-06-21 20:53:52.434850,2026-06-21 20:55:19.047879,0 days 00:01:26.613029,32,,64,0.2988049595242307,0.0006394285914269324,1,downsample_labels,1.2627087125895485e-05,0.0,PRUNED
14,0.6090907901525497,2026-06-21 20:55:19.061246,2026-06-21 20:57:57.055418,0 days 00:02:37.994172,32,0.318347963953445,256,0.09301116813168042,0.00018603029998985225,2,upsample_preds,3.0856138007007654e-05,0.318347963953445,COMPLETE
15,0.6931024193763733,2026-06-21 20:57:57.074997,2026-06-21 21:06:23.673441,0 days 00:08:26.598444,8,0.4991017359488531,64,0.15808475309669,0.0004973003020754156,2,downsample_labels,0.0003890397784295593,0.4991017359488531,PRUNED
16,0.7300243973731995,2026-06-21 21:06:23.690227,2026-06-21 21:12:10.598479,0 days 00:05:46.908252,32,,256,0.22867454654914462,0.0012493984120570652,1,downsample_labels,0.00036451166740044896,0.0,COMPLETE
17,0.6401720941066742,2026-06-21 21:12:10.618977,2026-06-21 21:14:18.677661,0 days 00:02:08.058684,32,0.24714482244959773,128,0.0022615805532526997,0.00019878239308918668,3,downsample_labels,3.5354003726621262e-06,0.24714482244959773,COMPLETE
18,0.6646486222743988,2026-06-21 21:14:18.698293,2026-06-21 21:20:26.671791,0 days 00:06:07.973498,16,,256,0.0900662675707871,0.00045139731823973163,1,upsample_preds,5.2245841526472894e-05,0.0,COMPLETE
19,0.6789053380489349,2026-06-21 21:20:26.691875,2026-06-21 21:27:46.649607,0 days 00:07:19.957732,8,0.4137039136987428,64,0.2660046756368012,0.0010037058231971625,2,downsample_labels,1.4946555983928273e-05,0.4137039136987428,COMPLETE
20,0.6529459953308105,2026-06-21 21:27:46.668848,2026-06-21 21:29:10.694189,0 days 00:01:24.025341,32,0.27241794414971837,64,0.2044460988423673,0.00018978252931103995,2,downsample_labels,0.0005693891704009243,0.27241794414971837,COMPLETE
21,0.7471242845058441,2026-06-21 21:29:10.713034,2026-06-21 21:33:24.169504,0 days 00:04:13.456470,32,0.004093887354114534,64,0.16735052815301826,0.00011272352995514762,2,downsample_labels,0.009619181416189714,0.004093887354114534,COMPLETE
22,0.7188350856304169,2026-06-21 21:33:24.190293,2026-06-21 21:35:48.116576,0 days 00:02:23.926283,32,0.0075106058128436015,64,0.13700337235141266,0.0001545469788391966,2,downsample_labels,0.0059650622493830135,0.0075106058128436015,COMPLETE
23,0.7479012310504913,2026-06-21 21:35:48.137485,2026-06-21 21:41:00.787860,0 days 00:05:12.650375,32,0.13560234190448342,64,0.16285076720940905,0.000447721232340501,3,downsample_labels,0.00017139892949463086,0.13560234190448342,COMPLETE
24,0.7551978230476379,2026-06-21 21:41:00.808362,2026-06-21 21:46:52.329338,0 days 00:05:51.520976,32,0.10772194835447264,64,0.16024040169345877,0.00044593513570294807,3,downsample_labels,0.0001881252253798348,0.10772194835447264,COMPLETE
25,0.35894060134887695,2026-06-21 21:46:52.350820,2026-06-21 21:47:44.129224,0 days 00:00:51.778404,32,0.10576247127075131,64,0.1631594048580543,0.002055516062930822,3,downsample_labels,2.8834140234915225e-05,0.10576247127075131,COMPLETE
26,0.6647655367851257,2026-06-21 21:47:44.148873,2026-06-21 21:49:12.905280,0 days 00:01:28.756407,32,0.10646478371824658,64,0.21007148914530424,0.0004681897149787263,3,upsample_preds,0.0007681594955028691,0.10646478371824658,COMPLETE
27,0.5973241031169891,2026-06-21 21:49:12.925146,2026-06-21 21:50:38.081905,0 days 00:01:25.156759,32,0.15685953338280256,64,0.17199075855374596,0.0010037354543496102,3,downsample_labels,0.003113584086806806,0.15685953338280256,PRUNED
28,0.5687545835971832,2026-06-21 21:50:38.096166,2026-06-21 21:53:03.670405,0 days 00:02:25.574239,16,0.05750631141559403,64,0.14119023759037108,0.0002199670672948613,3,downsample_labels,0.00020112208203503003,0.05750631141559403,PRUNED
29,0.6546316146850586,2026-06-21 21:53:03.683237,2026-06-21 21:58:39.381465,0 days 00:05:35.698228,8,0.004638358370963047,64,0.18496765134897403,0.00011041613057098235,3,downsample_labels,0.0008365047330010581,0.004638358370963047,PRUNED
30,0.715935081243515,2026-06-21 21:58:39.401614,2026-06-21 22:01:30.755773,0 days 00:02:51.354159,32,0.15114688168180582,64,0.11931725003315008,0.00013689585836411698,3,downsample_labels,0.0038746927186549354,0.15114688168180582,COMPLETE
31,0.653923511505127,2026-06-21 22:01:30.776967,2026-06-21 22:06:37.062855,0 days 00:05:06.285888,32,0.20541467513873946,256,0.15255828559129891,0.0003964683121032869,3,downsample_labels,0.00023706101377600993,0.20541467513873946,COMPLETE
32,0.5752537250518799,2026-06-21 22:06:37.083698,2026-06-21 22:11:39.876361,0 days 00:05:02.792663,32,0.10140328705657639,512,0.17733133127877504,0.0002430959444428928,2,downsample_labels,0.009071363209266808,0.10140328705657639,COMPLETE
33,0.5822530388832092,2026-06-21 22:11:39.899003,2026-06-21 22:13:18.027003,0 days 00:01:38.128000,32,0.05158982071761556,128,0.07450901750743229,0.0005796552374442469,3,downsample_labels,5.55740495030397e-05,0.05158982071761556,COMPLETE
34,0.5348818898200989,2026-06-21 22:13:18.047613,2026-06-21 22:16:58.591642,0 days 00:03:40.544029,32,0.12992512189638675,256,0.21740225174008138,0.0003694631152344734,2,downsample_labels,0.00018820618247077244,0.12992512189638675,PRUNED
35,0.6528126001358032,2026-06-21 22:16:58.604985,2026-06-21 22:18:46.065185,0 days 00:01:47.460200,32,0.20259205288578913,64,0.11754916668223583,0.0008179794608152772,3,downsample_labels,3.6611210419265344e-05,0.20259205288578913,PRUNED
36,0.6076129376888275,2026-06-21 22:18:46.083925,2026-06-21 22:21:18.363315,0 days 00:02:32.279390,32,,512,0.19742398433525027,0.00025180046798054244,1,downsample_labels,0.0018703405041447065,0.0,COMPLETE
37,0.7453500032424927,2026-06-21 22:21:18.383098,2026-06-21 22:26:56.127735,0 days 00:05:37.744637,32,0.053255405511510784,128,0.13648193409317516,0.0008731732449495674,2,downsample_labels,0.0010753705987860936,0.053255405511510784,COMPLETE
38,0.5420454144477844,2026-06-21 22:26:56.148624,2026-06-21 22:29:46.101666,0 days 00:02:49.953042,16,0.07279599523197568,128,0.1369469773226003,0.0014992531464148228,2,downsample_labels,0.005338772934703197,0.07279599523197568,PRUNED
39,0.5720077753067017,2026-06-21 22:29:46.114713,2026-06-21 22:34:57.502306,0 days 00:05:11.387593,8,0.04550914376458076,128,0.09929566712336607,0.0008859130420337926,2,downsample_labels,0.0009453604946451744,0.04550914376458076,PRUNED
40,0.2743759173899889,2026-06-21 22:34:57.514427,2026-06-21 22:36:00.549494,0 days 00:01:03.035067,32,0.0947182931459285,128,0.16615569477617825,0.0018900515926122859,2,downsample_labels,0.0013802292251526105,0.0947182931459285,COMPLETE
41,0.6386182606220245,2026-06-21 22:36:00.569519,2026-06-21 22:37:22.576225,0 days 00:01:22.006706,32,,128,0.0648523817661464,0.0005472175772539655,1,downsample_labels,0.0001341196069606767,0.0,PRUNED
42,0.5440956950187683,2026-06-21 22:37:22.589281,2026-06-21 22:43:18.267366,0 days 00:05:55.678085,32,0.030147359160916737,256,0.020018795855120456,0.000407476524832545,3,downsample_labels,0.0002768072161241762,0.030147359160916737,PRUNED
43,0.6385733187198639,2026-06-21 22:43:18.279728,2026-06-21 22:44:40.969278,0 days 00:01:22.689550,32,,128,0.04525445191660576,0.0007312315166116691,1,downsample_labels,9.050292364197987e-05,0.0,PRUNED
44,0.5443516373634338,2026-06-21 22:44:40.981939,2026-06-21 22:51:12.629198,0 days 00:06:31.647259,32,0.07544207909031568,512,0.1475252897461798,0.000318866963826172,3,downsample_labels,0.00046604325206385115,0.07544207909031568,COMPLETE
45,0.5719667971134186,2026-06-21 22:51:12.647934,2026-06-21 22:52:14.645800,0 days 00:01:01.997866,32,,64,0.18017218622432524,0.0012102429492529957,1,upsample_preds,0.00015461696421068704,0.0,COMPLETE
46,0.5950864553451538,2026-06-21 22:52:14.664057,2026-06-21 22:58:23.050906,0 days 00:06:08.386849,16,0.024825993919299835,256,0.1251100118018513,0.00015762094141831773,2,downsample_labels,0.002556223735848179,0.024825993919299835,PRUNED
47,0.6456653475761414,2026-06-21 22:58:23.063178,2026-06-21 22:59:43.870721,0 days 00:01:20.807543,32,0.13907680421925253,64,0.11039674595038568,0.0006130525020016922,3,downsample_labels,7.038975426154784e-05,0.13907680421925253,COMPLETE
48,0.5795964896678925,2026-06-21 22:59:43.888268,2026-06-21 23:00:44.593914,0 days 00:01:00.705646,32,,128,0.08107138952613649,0.00025319139464952746,1,upsample_preds,0.0006074076809750145,0.0,COMPLETE
49,0.4523351639509201,2026-06-21 23:00:44.611722,2026-06-21 23:07:07.917184,0 days 00:06:23.305462,8,0.1815441841685722,256,0.19682176423455722,0.0005001974769511955,2,downsample_labels,0.00025338410375582316,0.1815441841685722,COMPLETE
50,0.7297719120979309,2026-06-21 23:07:07.937982,2026-06-21 23:10:19.110181,0 days 00:03:11.172199,32,0.0031534744367862693,64,0.2253343023392792,0.0006761803905179667,2,downsample_labels,0.0003051476442647588,0.0031534744367862693,COMPLETE
51,0.7499619722366333,2026-06-21 23:10:19.134037,2026-06-21 23:14:44.244493,0 days 00:04:25.110456,32,0.2669772116135271,64,0.2536012150428556,0.0002911152624601804,2,downsample_labels,0.0001051747133627637,0.2669772116135271,COMPLETE
52,0.7536899745464325,2026-06-21 23:14:44.282370,2026-06-21 23:18:11.196200,0 days 00:03:26.913830,32,0.22931033651405314,64,0.25036259879560274,0.00028576127989443135,2,downsample_labels,0.00010703910308706851,0.22931033651405314,COMPLETE
53,0.7486205995082855,2026-06-21 23:18:11.216141,2026-06-21 23:21:34.021817,0 days 00:03:22.805676,32,0.2408712222929245,64,0.2507709113842974,0.0002732151870940939,2,downsample_labels,0.00011643885750187337,0.2408712222929245,COMPLETE
54,0.7125158309936523,2026-06-21 23:21:34.042163,2026-06-21 23:24:37.523270,0 days 00:03:03.481107,32,0.24786479165171177,64,0.26015986984595746,0.000287984544294102,2,downsample_labels,1.9585474879423527e-05,0.24786479165171177,PRUNED
55,0.7472643554210663,2026-06-21 23:24:37.539193,2026-06-21 23:29:25.575786,0 days 00:04:48.036593,32,0.27486843903568814,64,0.2526101247839381,0.0003652078307517615,2,downsample_labels,0.00010774188990158262,0.27486843903568814,COMPLETE
56,0.5808340907096863,2026-06-21 23:29:25.597607,2026-06-21 23:30:48.507668,0 days 00:01:22.910061,32,0.2999212318402895,64,0.24678754579602882,0.00035362312460237823,2,downsample_labels,0.0001159203983725312,0.2999212318402895,PRUNED
57,0.7542900741100311,2026-06-21 23:30:48.520935,2026-06-21 23:35:03.735226,0 days 00:04:15.214291,32,0.2275464543030944,64,0.28307805667384756,0.0002776995067276986,2,downsample_labels,6.953053357328581e-05,0.2275464543030944,COMPLETE
58,0.6473355293273926,2026-06-21 23:35:03.757385,2026-06-21 23:36:23.915044,0 days 00:01:20.157659,32,0.24145811894671335,64,0.28059486389761457,0.0002985482232045527,2,upsample_preds,4.461517443823102e-05,0.24145811894671335,COMPLETE
59,0.6447349488735199,2026-06-21 23:36:23.936127,2026-06-21 23:38:50.786952,0 days 00:02:26.850825,16,0.224278245485788,64,0.299588453302535,0.0001689147763741123,2,downsample_labels,7.108047459576615e-05,0.224278245485788,PRUNED
60,0.7472158372402191,2026-06-22 22:57:34.983816,2026-06-22 23:01:32.705249,0 days 00:03:57.721433,32,0.27680390487371304,64,0.28666746597908344,0.00021530629673983953,2,downsample_labels,2.1206551805691218e-05,0.27680390487371304,COMPLETE
61,0.6320376396179199,2026-06-22 23:01:32.735568,2026-06-22 23:02:45.014528,0 days 00:01:12.278960,32,0.3534507716568063,64,0.2522299487325684,0.000440238606550763,2,downsample_labels,0.00016471855113281024,0.3534507716568063,PRUNED
62,0.7544006109237671,2026-06-22 23:02:45.032181,2026-06-22 23:06:03.121883,0 days 00:03:18.089702,32,0.2875498633754883,64,0.23575774991411536,0.000330198538960678,2,downsample_labels,9.15320920832871e-05,0.2875498633754883,COMPLETE
63,0.6135456264019012,2026-06-22 23:06:03.144381,2026-06-22 23:06:55.804819,0 days 00:00:52.660438,32,0.30515779897756434,64,0.2344389137011332,0.0002680774947781972,2,downsample_labels,8.065896620271953e-05,0.30515779897756434,COMPLETE
64,0.6849024593830109,2026-06-22 23:06:55.827276,2026-06-22 23:08:15.214054,0 days 00:01:19.386778,32,0.3378546560586625,64,0.26931233198763016,0.0003261117975226616,2,downsample_labels,5.674146054798149e-05,0.3378546560586625,PRUNED
65,0.5624929964542389,2026-06-22 23:08:15.231361,2026-06-22 23:10:31.932227,0 days 00:02:16.700866,8,0.22405322647211523,64,0.279175129943021,0.00021327662640527293,2,downsample_labels,0.00012930661837504183,0.22405322647211523,PRUNED
66,0.5631564557552338,2026-06-22 23:10:31.950335,2026-06-22 23:11:26.580875,0 days 00:00:54.630540,32,0.1814809309673724,64,0.24386711581786005,0.004613331915216078,2,downsample_labels,3.904896786355997e-05,0.1814809309673724,PRUNED
67,0.6470912992954254,2026-06-22 23:11:26.596739,2026-06-22 23:11:55.228977,0 days 00:00:28.632238,32,0.38187369745742644,64,0.21808942553641342,0.0004346501558267577,2,downsample_labels,5.109433272102703e-06,0.38187369745742644,COMPLETE
68,0.7331069111824036,2026-06-22 23:11:55.251596,2026-06-22 23:13:30.730220,0 days 00:01:35.478624,32,0.2677609235424769,64,0.2381375459327536,0.0005061727125635567,2,upsample_preds,0.00019597600185579695,0.2677609235424769,COMPLETE
69,0.6468222439289093,2026-06-22 23:13:30.751515,2026-06-22 23:14:14.573463,0 days 00:00:43.821948,32,0.29014352486571854,64,0.2897499420196448,0.00023073585823374032,2,downsample_labels,2.504793809854944e-05,0.29014352486571854,COMPLETE
70,0.7367088794708252,2026-06-22 23:14:14.596304,2026-06-22 23:16:29.055418,0 days 00:02:14.459114,32,0.16301380832431353,64,0.2614433213197819,0.0002876456229318902,3,downsample_labels,6.333647531094454e-05,0.16301380832431353,COMPLETE
71,0.7389543950557709,2026-06-22 23:16:29.075907,2026-06-22 23:18:52.944103,0 days 00:02:23.868196,32,0.26522192097390335,64,0.2530930310445312,0.0003854883029316319,2,downsample_labels,9.57734482143678e-05,0.26522192097390335,COMPLETE
72,0.7463359534740448,2026-06-22 23:18:52.967187,2026-06-22 23:20:45.951111,0 days 00:01:52.983924,32,0.22491622177589893,64,0.2775242818713889,0.00035158398473482465,2,downsample_labels,9.521259207388143e-05,0.22491622177589893,COMPLETE
73,0.7335476875305176,2026-06-22 23:20:45.973190,2026-06-22 23:22:27.994330,0 days 00:01:42.021140,32,0.2819792428903008,64,0.25207644297022774,0.00018013742328361966,2,downsample_labels,0.0001307762944610778,0.2819792428903008,COMPLETE
74,0.6573419570922852,2026-06-22 23:22:28.016149,2026-06-22 23:23:00.289584,0 days 00:00:32.273435,32,0.31838762332747794,64,0.22930014161109086,0.00027107327965811257,2,downsample_labels,0.0002160539676692312,0.31838762332747794,COMPLETE
75,0.5684973895549774,2026-06-22 23:23:00.310122,2026-06-22 23:25:40.651692,0 days 00:02:40.341570,32,0.23797687006531631,512,0.263231696228273,0.0003357136264792094,2,downsample_labels,0.00035007337859000126,0.23797687006531631,PRUNED
76,0.6225757300853729,2026-06-22 23:25:40.668482,2026-06-22 23:26:54.298211,0 days 00:01:13.629729,16,0.2523599473642906,64,0.20889067913874138,0.00038315788053283807,2,downsample_labels,4.66108171795293e-05,0.2523599473642906,PRUNED
77,0.7399125099182129,2026-06-22 23:26:54.314318,2026-06-22 23:28:49.301228,0 days 00:01:54.986910,32,0.2155782890761065,64,0.2719007678248687,0.0004155642521939991,2,downsample_labels,9.358918263479009e-05,0.2155782890761065,COMPLETE
78,0.7058780789375305,2026-06-22 23:28:49.322612,2026-06-22 23:31:25.230480,0 days 00:02:35.907868,8,0.12107647087547414,64,0.218588999171998,0.0005492476796591762,2,downsample_labels,0.00015345976701071197,0.12107647087547414,COMPLETE
79,0.7463226318359375,2026-06-22 23:31:25.251822,2026-06-22 23:34:15.205266,0 days 00:02:49.953444,32,0.18393491385712152,64,0.1877746370252591,0.00023559996577364676,3,downsample_labels,3.5518729422464894e-05,0.18393491385712152,COMPLETE
80,0.6744278073310852,2026-06-22 23:34:15.226953,2026-06-22 23:35:22.227994,0 days 00:01:07.001041,32,0.25583799236905647,64,0.2897546355427114,0.00020028414173644315,2,downsample_labels,0.00011469907265220487,0.25583799236905647,PRUNED
81,0.7482294142246246,2026-06-22 23:35:22.243992,2026-06-22 23:38:22.904413,0 days 00:03:00.660421,32,0.2795951342678965,64,0.2860327741302586,0.00031290806283530167,2,downsample_labels,1.2168147196349882e-05,0.2795951342678965,COMPLETE
82,0.6670982241630554,2026-06-22 23:38:22.926437,2026-06-22 23:39:31.660703,0 days 00:01:08.734266,32,0.33246496568980105,64,0.25757458487423707,0.0003206374044874207,3,downsample_labels,0.000451302636282999,0.33246496568980105,PRUNED
83,0.7479850053787231,2026-06-22 23:39:31.676771,2026-06-22 23:42:19.656480,0 days 00:02:47.979709,32,0.2963669531490197,64,0.27015802444091275,0.00027007595238391646,2,downsample_labels,1.4981545913594173e-06,0.2963669531490197,COMPLETE
84,0.6702606976032257,2026-06-22 23:42:19.676042,2026-06-22 23:43:39.730594,0 days 00:01:20.054552,32,0.2950019935707875,64,0.27111705813254994,0.00026309141192368274,2,downsample_labels,1.7763208602194104e-06,0.2950019935707875,PRUNED
85,0.6735971868038177,2026-06-22 23:43:39.747284,2026-06-22 23:44:48.182233,0 days 00:01:08.434949,32,0.3084260013938452,64,0.24006622446268977,0.00047242696544522823,2,downsample_labels,6.689763607050557e-06,0.3084260013938452,PRUNED
86,0.4907863289117813,2026-06-22 23:44:48.199664,2026-06-22 23:48:24.858523,0 days 00:03:36.658859,32,0.2072012661303153,512,0.29348233860364037,0.00030138675644649193,3,downsample_labels,2.443635541178351e-06,0.2072012661303153,COMPLETE
87,0.746748298406601,2026-06-22 23:48:25.052831,2026-06-22 23:51:22.054822,0 days 00:02:57.001991,32,0.25550233026089747,64,0.27888735379578294,0.0002447807617541833,2,upsample_preds,1.0797408240364923e-05,0.25550233026089747,COMPLETE
88,0.7468949258327484,2026-06-22 23:51:22.076991,2026-06-22 23:54:31.517232,0 days 00:03:09.440241,32,0.2372722022239533,64,0.26492223522811853,0.00013713544768447104,2,downsample_labels,6.223204794256624e-06,0.2372722022239533,COMPLETE
89,0.5777347683906555,2026-06-22 23:54:31.538381,2026-06-22 23:55:51.449681,0 days 00:01:19.911300,16,0.16835782352051043,64,0.1548173089136374,0.00027479479726325604,3,downsample_labels,1.4008448705576009e-06,0.16835782352051043,COMPLETE
90,0.7581793963909149,2026-06-22 23:55:51.471267,2026-06-22 23:58:14.584140,0 days 00:02:23.112873,32,0.44161238011919646,64,0.24549311370984117,0.0002053173890108923,2,downsample_labels,1.3920002645653504e-05,0.44161238011919646,COMPLETE
91,0.6505654156208038,2026-06-22 23:58:14.607623,2026-06-22 23:59:07.659062,0 days 00:00:53.051439,32,0.4630335244381448,64,0.248637282309719,0.00020455965076852697,2,downsample_labels,2.7236173404178073e-06,0.4630335244381448,PRUNED
